{
  "$schema": "https://json-schema.org/draft/2020-12/schema",
  "$id": "https://philofobreal.github.io/developer-exercise/schema.json",
  "title": "ngDynamic CodeLine v2 Exercise",
  "type": "object",
  "additionalProperties": false,
  "required": [
    "schemaVersion",
    "id",
    "revision",
    "language",
    "title",
    "description",
    "lines",
    "blocks"
  ],
  "properties": {
    "schemaVersion": {
      "const": 2
    },
    "id": {
      "type": "string",
      "minLength": 1,
      "maxLength": 200
    },
    "revision": {
      "type": "integer",
      "minimum": 1,
      "maximum": 9007199254740991
    },
    "language": {
      "enum": [
        "javascript",
        "typescript"
      ]
    },
    "title": {
      "type": "string",
      "maxLength": 140
    },
    "description": {
      "type": "string",
      "maxLength": 500
    },
    "lines": {
      "type": "array",
      "minItems": 1,
      "maxItems": 500,
      "items": {
        "$ref": "#/$defs/codeLine"
      }
    },
    "blocks": {
      "type": "array",
      "maxItems": 250,
      "items": {
        "$ref": "#/$defs/block"
      }
    },
    "edges": {
      "type": "array",
      "items": {
        "$ref": "#/$defs/edge"
      },
      "maxItems": 5000
    },
    "profiles": {
      "type": "array",
      "maxItems": 32,
      "items": {
        "type": "object",
        "required": [
          "id",
          "edges"
        ],
        "additionalProperties": false,
        "properties": {
          "id": {
            "type": "string",
            "minLength": 1,
            "maxLength": 200
          },
          "edges": {
            "type": "array",
            "items": {
              "$ref": "#/$defs/edge"
            },
            "maxItems": 5000
          }
        }
      }
    },
    "authoring": {
      "type": "object",
      "additionalProperties": false,
      "properties": {
        "strategy": {
          "type": "string",
          "maxLength": 100
        },
        "reason": {
          "type": "string",
          "maxLength": 500
        },
        "note": {
          "type": "string",
          "maxLength": 1000
        },
        "omittedBlocks": {
          "type": "integer",
          "minimum": 0,
          "maximum": 500
        },
        "semanticEquivalenceProven": {
          "const": false
        },
        "dependencyHints": {
          "type": "array",
          "maxItems": 200,
          "items": {
            "type": "object",
            "additionalProperties": false,
            "required": [
              "name",
              "declarationLine",
              "usageLine"
            ],
            "properties": {
              "name": {
                "type": "string",
                "maxLength": 2048
              },
              "declarationLine": {
                "type": "integer",
                "minimum": 1,
                "maximum": 50000
              },
              "usageLine": {
                "type": "integer",
                "minimum": 1,
                "maximum": 50000
              }
            }
          }
        },
        "dependencyPolicy": {
          "type": "string",
          "enum": [
            "primitive-const-islands-v1",
            "scoped-primitive-dag-v2",
            "scoped-type-members-v3"
          ]
        }
      }
    }
  },
  "$defs": {
    "codeLine": {
      "type": "object",
      "additionalProperties": false,
      "required": [
        "id",
        "code",
        "dependencies",
        "fixed",
        "functionBlock",
        "scopeId"
      ],
      "properties": {
        "id": {
          "type": "integer",
          "minimum": 1,
          "maximum": 9007199254740991,
          "description": "Stable identity within this exercise revision; never the current solution position."
        },
        "code": {
          "type": "string",
          "maxLength": 2048,
          "pattern": "^[^\\r\\n\\u2028\\u2029]*$"
        },
        "dependencies": {
          "type": "array",
          "uniqueItems": true,
          "items": {
            "type": "integer",
            "minimum": 1
          },
          "maxItems": 500,
          "description": "IDs of all required predecessors. Each must occur earlier, at any distance; array order is irrelevant."
        },
        "fixed": {
          "type": "boolean"
        },
        "functionBlock": {
          "type": "integer",
          "minimum": 0,
          "maximum": 9007199254740991
        },
        "scopeId": {
          "anyOf": [
            {
              "type": "string",
              "minLength": 1,
              "maxLength": 200
            },
            {
              "type": "null"
            }
          ]
        },
        "normalization": {
          "enum": [
            "indent",
            "exact"
          ]
        },
        "sourceLine": {
          "type": "integer",
          "minimum": 1,
          "maximum": 50000,
          "description": "Optional one-based original physical source line; informational, never an identity or ordering constraint."
        }
      }
    },
    "block": {
      "type": "object",
      "additionalProperties": false,
      "required": [
        "id",
        "kind",
        "parentScopeId",
        "openLineId",
        "closeLineId"
      ],
      "properties": {
        "id": {
          "type": "string",
          "minLength": 1,
          "maxLength": 200
        },
        "kind": {
          "enum": [
            "function",
            "block"
          ]
        },
        "functionBlock": {
          "type": "integer",
          "minimum": 1,
          "maximum": 9007199254740991
        },
        "parentScopeId": {
          "anyOf": [
            {
              "type": "string",
              "minLength": 1,
              "maxLength": 200
            },
            {
              "type": "null"
            }
          ]
        },
        "openLineId": {
          "type": "integer",
          "minimum": 1,
          "maximum": 9007199254740991
        },
        "closeLineId": {
          "type": "integer",
          "minimum": 1,
          "maximum": 9007199254740991
        }
      },
      "anyOf": [
        {
          "properties": {
            "kind": {
              "const": "function"
            },
            "functionBlock": {}
          },
          "required": [
            "functionBlock"
          ]
        },
        {
          "properties": {
            "kind": {
              "const": "block"
            }
          },
          "not": {
            "required": [
              "functionBlock"
            ],
            "properties": {
              "functionBlock": {}
            }
          }
        }
      ]
    },
    "edge": {
      "type": "object",
      "additionalProperties": false,
      "required": [
        "before",
        "after"
      ],
      "properties": {
        "before": {
          "type": "integer",
          "minimum": 1,
          "maximum": 9007199254740991
        },
        "after": {
          "type": "integer",
          "minimum": 1,
          "maximum": 9007199254740991
        }
      }
    }
  }
}
