{
  "schemaVersion": 2,
  "id": "evaluate-ordering",
  "revision": 1,
  "language": "javascript",
  "title": "Függőségek – evaluate()",
  "description": "A note, a és b egymástól független. A c az a és b után, a return pedig c és note után következhet.",
  "lines": [
    {
      "id": 1,
      "sourceLine": 1,
      "code": "function evaluate() {",
      "dependencies": [],
      "fixed": false,
      "functionBlock": 1,
      "scopeId": null,
      "normalization": "indent"
    },
    {
      "id": 2,
      "sourceLine": 2,
      "code": "     const note = 'ready';",
      "dependencies": [
        1
      ],
      "fixed": false,
      "functionBlock": 1,
      "scopeId": "scope-1",
      "normalization": "indent"
    },
    {
      "id": 3,
      "sourceLine": 3,
      "code": "     const a = 10;",
      "dependencies": [
        1
      ],
      "fixed": false,
      "functionBlock": 1,
      "scopeId": "scope-1",
      "normalization": "indent"
    },
    {
      "id": 4,
      "sourceLine": 4,
      "code": "     const b = 20;",
      "dependencies": [
        1
      ],
      "fixed": false,
      "functionBlock": 1,
      "scopeId": "scope-1",
      "normalization": "indent"
    },
    {
      "id": 5,
      "sourceLine": 5,
      "code": "     const c = a + b;",
      "dependencies": [
        3,
        4
      ],
      "fixed": false,
      "functionBlock": 1,
      "scopeId": "scope-1",
      "normalization": "indent"
    },
    {
      "id": 6,
      "sourceLine": 6,
      "code": "     return { c, note };",
      "dependencies": [
        2,
        5
      ],
      "fixed": false,
      "functionBlock": 1,
      "scopeId": "scope-1",
      "normalization": "indent"
    },
    {
      "id": 7,
      "sourceLine": 7,
      "code": "}",
      "dependencies": [
        6
      ],
      "fixed": false,
      "functionBlock": 1,
      "scopeId": null,
      "normalization": "indent"
    }
  ],
  "blocks": [
    {
      "id": "scope-1",
      "kind": "function",
      "parentScopeId": null,
      "openLineId": 1,
      "closeLineId": 7,
      "functionBlock": 1
    }
  ],
  "edges": [],
  "profiles": [],
  "authoring": {
    "strategy": "ast-hierarchy",
    "reason": "",
    "omittedBlocks": 0,
    "semanticEquivalenceProven": false,
    "dependencyPolicy": "scoped-primitive-dag-v2",
    "dependencyHints": [
      {
        "name": "a",
        "declarationLine": 3,
        "usageLine": 5
      },
      {
        "name": "b",
        "declarationLine": 4,
        "usageLine": 5
      }
    ]
  }
}
