{
  "schemaVersion": 2,
  "id": "ts-sample-02-interface",
  "revision": 1,
  "language": "typescript",
  "title": "Három külön nevű típusmező",
  "description": "A readonly és opcionális adatmezők is típusinformációk; mind a hat belső sorrend megengedett.",
  "lines": [
    {
      "id": 1,
      "sourceLine": 1,
      "code": "interface Options {",
      "dependencies": [],
      "fixed": false,
      "functionBlock": 0,
      "scopeId": null,
      "normalization": "indent"
    },
    {
      "id": 2,
      "sourceLine": 2,
      "code": "  readonly title: string;",
      "dependencies": [
        1
      ],
      "fixed": false,
      "functionBlock": 0,
      "scopeId": "scope-1",
      "normalization": "indent"
    },
    {
      "id": 3,
      "sourceLine": 3,
      "code": "  count?: number;",
      "dependencies": [
        1
      ],
      "fixed": false,
      "functionBlock": 0,
      "scopeId": "scope-1",
      "normalization": "indent"
    },
    {
      "id": 4,
      "sourceLine": 4,
      "code": "  enabled: boolean;",
      "dependencies": [
        1
      ],
      "fixed": false,
      "functionBlock": 0,
      "scopeId": "scope-1",
      "normalization": "indent"
    },
    {
      "id": 5,
      "sourceLine": 5,
      "code": "}",
      "dependencies": [
        2,
        3,
        4
      ],
      "fixed": false,
      "functionBlock": 0,
      "scopeId": null,
      "normalization": "indent"
    }
  ],
  "blocks": [
    {
      "id": "scope-1",
      "kind": "block",
      "parentScopeId": null,
      "openLineId": 1,
      "closeLineId": 5
    }
  ],
  "edges": [],
  "profiles": [],
  "authoring": {
    "strategy": "ast-hierarchy",
    "reason": "",
    "omittedBlocks": 0,
    "semanticEquivalenceProven": false,
    "dependencyPolicy": "scoped-type-members-v3",
    "note": "A külön nevű, egysoros interface-/típusadatmezők és declare osztálymezők felcserélhetők. A rendes osztálymezők és this-értékadások sorrendje megmarad: mezőlétrehozás, kulcssorrend, setter, öröklés és inicializálási hatás is megfigyelhető. Az overloadok, duplikált nevek, kommentek és összetett sorok konzervatívak. Ez szintaktikai audit és korlátozott sorrendelemzés, nem teljes TypeScript típusellenőrzés.",
    "dependencyHints": []
  }
}
